title,text,score,num_comments,created_date,author,flair,upvote_ratio
The Remains of the Day - Kazuo Ishiguro,"It took me a long time to finish this book. And don’t take me wrong, Kazuo Ishiguro’s prose has a very good flow and is very dynamic; however, the topic was not *it.* His style of writing is very easy to read and follow, but the book itself never grabs you.

This book is Mr. Stevens’ memoir written during his 3-day trip along the English country. Mr. Stevens is an old-fashioned butler in a post-war house in England. It could be said that he was the best butler of his time: a devoted butler who sacrificed everything in his life to make sure he was doing his job with dignity and to serve his lord. He was extremely proud of his job as a butler and of the state the house was at. He even believed he had an impact in the world-affairs: big world leaders would meet at Darlington Hall to make decisions regarding the war, and Mr. Stevens believed details such as the silverware affected this meetings. He rejected a family to serve his lord, and was even humiliated in a couple of occasions. He was often made fun of by the leaders that visited the house, just to prove that the everyday man is dumb. And instead of being humiliated he felt proud of being able to serve his lord. His sacrifice went as far as to keep serving his lord the day that Mr. Stevens’ father passed away. When the doctor came to see his dad, Mr. Stevens insisted the doctor should take care of one of the guests of the banquet instead.

The book revolves around Mr. Stevens’ reflexions about what being a good butler is, all things he did as a butler that make a difference between a good butler and a bad butler. The book gets tedious when the butler describes in detail his staff organization, the special dust-sheeting the unoccupied wings should get, the handmaids shifts, and so on.

Apparently Darlington Hall was one of the most successful houses in the prewar period. However, Lord Darlington fell out of the grace of the public eye when his relationships with the Germans were discovered during the war (apparently he was trying to get Hitler and the prime minister to meet). Stevens was such a loyal servant that when hinted about this, he believed his Lord Darlington was right and people just could not understand it. After the war ended, Lord Darlington passed away and the house was bought by an American Mr. Faraday. Mr. Faraday did not have as much guests as Lord Darlington back in the day, so the job was easier. Nevertheless, Stevens started noticing he was committing more mistakes, and it should be added that they were really small mistakes, not noticed by Mr. Faraday. But Stevens is an over-analyst, and however small the mistake was, he would analyze it to death. He noticed how Faraday would make comments expecting a witty response or banter from Stevens, and Stevens not being used to that would be silent. So Stevens started practicing his “witticisms” daily.

The real action of the book is Stevens trip driving his boss’s Ford to Cornwall to visit the former Darlington Hall housekeeper, Miss Kenton. Miss Kenton was Stevens’ colleague, and he made sure to keep the relationship a working one. Apparently she tried to flirt with Stevens and admired him, but he was just to busy to notice. Eventually she met Mr. Benn and left after marrying him.

After a three day trip they meet in Cornwall at a hotel, and Miss Kenton tells Stevens about her marriage, how she didn’t love Mr. Benn at first, but she was running out of time to marry and have children. After having her daughter, she started loving her husband and being happier. But she still thinks about what could have been if her and Stevens had been a thing. The purpose of the trip was also to try and convince Miss Kenton to go back to Darlington Hall to work, since her letters made it seem like she had problems in her marriage. But it turned out everything was ok.

The climax of the book comes at the end, when Mr. Stevens is thinking and sees the lights turn on giving a beautiful spectacle. Someone tells him the evening is the best part of the day, and everyone is waiting for the evening to see the lights. He starts talking with someone, and tells him how he gave everything for Lord Darlington, and how now he was starting to commit mistakes. The person he was talking to told him to just enjoy, as he was now in the most expected part of the life: the evening, so he should embrace and live the remains of the day.",0,40,2025-09-24,LiterallySagan,N/A,0.44
My thoughts on the rest of The Remains of the Day by Kazuo Ishiguro,"This book has left me with a lot of feelings that are difficult to really put words to. It’s rare that I encounter something so inherently irritating to me but still so intriguing. When I read the first chapter of the book I felt like this book would not be for me. I described these feelings in a previous reddit post ([link](https://www.reddit.com/r/books/comments/1ni9nx5/my_thoughts_on_the_prologue_of_the_remains_of_the/)). However, and almost in spite, I kept reading and could not put it down. I wanted to see what was up with this silly butler, and what antics his utter devotion to his job would get him into. It really goes to show how impressive Ishiguro is that he keeps the reader so enticed, even through these negative feelings. The back of the book does little, I believe, to really prepare you for the contents of it. This book isn’t just a short trip through the English countryside. It’s a deep introspection on this particular man’s life, and how his personal philosophy and dedication to his role as a butler shapes the rest of his existence. When reading the comments on my last reddit post. I got the sense that he would “learn something” by the end of the book, that he would somehow change as a character. Guys, he doesn’t really change at all. His last few lines still show that he is first and foremost a butler, and that any personal interest he has must first be sieved by his butler role. There are hints here and there that maybe he will change, but it seems evident that he will continue to rely his personal self worth in how good of a butler he is or isn’t. 

There are some truly beautiful parts of this book. I found that the most interesting, engaging parts were when his butler duties were put in conflict against what would seem to be his personal interests. The best example of this are his recollections of some of his proudest days in the Salisbury chapter. In this chapter he pushes through the emotional turmoil from his complicating relationship with Ms. Kenton and his father dying of  a stroke to serve guests who could have a large impact on world affairs. He seems to associate this as his proudest day because, in spite of his beloved father dying and diminishing relationship with his good friend Ms. Kenton, he fulfills his role as a butler exceptionally. This chapter blew me away. It describes the utter dedication Mr. Stevens has to his work, the seemingly valid reasons for why he lives that way, and the tragedy that is being unable to tend to his own personal affairs in sacrifice to his work. 

I like this book. I do not like the main character. I sympathize and root for him however. I want him to live a happy life. I want him to find fulfillment. The way he chooses to seek fulfillment is through his dedication to his role. I think he is extremely misguided, but I still wish him the best. I got really pissed off in the way he ended his cocoa relationship with Ms. Kenton, even when she tried to reignite this routine with him, he stubbornly pushed away one of the only close friends he had for almost nothing. It was pure stupid, and hardly even in the interest of “being a good butler.” I think a lot of people who read this book don’t seem to feel me on this point. I think it’s okay to admit that Mr. Stevens is a pathetic, misguided, silly little guy. In fact, I’m almost sure that this is the point. We are supposed to feel sorry for him, and maybe decide that his lifestyle is not one that we want to partake in.

I think part of me feels that this book isn’t meant for me. I’m not the audience the author wanted to reach. I don’t subscribe to the old ways of English classism, I’m not one to dedicate myself so fully to a role that I lose myself in it. I don’t really feel like I’m walking away from this book having learned something important or profound. I’m just thankful that I am already the way that I am. The book was worth the read though. Its technique and style is really something to behold, and will be something I compare future books to. 

8/10. Would waste my time on this book again. 

",38,29,2025-09-22,on-reddit-for-pewds,N/A,0.71
"What Books did You Start or Finish Reading this Week?: September 22, 2025","Hi everyone!

What are you reading? What have you recently finished reading? What do you think of it? We want to know!

We're displaying the books found in this thread in the book strip at the top of the page. If you want the books you're reading included, use the formatting below.

**Formatting your book info**

Post your book info in this format:

**the title, by the author** 

For example:

**The Bogus Title, by Stephen King**

* This formatting is voluntary but will help us include your selections in the book strip banner.

* Entering your book data in this format will make it easy to collect the data, and the bold text will make the books titles stand out and might be a little easier to read.

* Enter as many books per post as you like but only the parent comments will be included. Replies to parent comments will be ignored for data collection.

* To help prevent errors in data collection, please double check your spelling of the title and author.

**NEW**: Would you like to ask the author you are reading (or just finished reading) a question? Type **!invite** in your comment and we will reach out to them to request they join us for a community Ask Me Anything event!

-Your Friendly /r/books Moderator Team",127,646,2025-09-22,AutoModerator,WeeklyThread,0.93
Notes on an execution!! Waait this was supposed to focus on women?,"Okay I finished this a few weeks ago and forgot to write a review but I have four opinions.


1. How beautifully suspenseful
2. Woaaah what pretty writing
3. Wait this is supposed to focus on the women? 
4. This is more fantasy than I expected—


I shall focus on 3 and 4 because 1 and 2 speak for themselves.
Okay so the book is very much marketed as being focused on the women the serial killer affected. This…is not true. There are four different viewpoints. The serial killer’s mom, his wife’s sister, a girl he met in his childhood, and naturally, his. Impressively, they all revolve around the serial killer! The irony lies in the fact that the book has FOUR women’s POVs and a single man’s. A book is usually about the guy who shows up the most often and obviously that’s the serial killer the book definitely isn’t about—-I just found that vaguely amusing. Either it’s a marketing error or the author is in denial. Also, in case you’re wondering, Ansel definitely is more fleshed out than all the female characters combined. >! Also!! Once again contrary to the message of the book, he did in fact go out with more fanfare than he deserved. Poor Blue. girly got so roped in. !<


Okay, four! It’s not actually fantasy worry not, but also?? What was that business about (minor spoiler I wouldn’t even consider it a spoiler actually) >! This brother screaming in my guy’s head? !< I know pretty little about mental health disorders and I accept that completely, but it literally made the serial killer another tortured man after all that work trying to make the book focus on the women that guy hurt. It’s like it was trying to add (very unneeded) ambiguity that would’ve been better in one of those women’s POVs the book was supposedly supposed to focus on. What exactly was that screaming thing based on anyway? Do tell if anybody has a reason for this cause I cannot think of a single reason that was a half decent idea, unless it was based on a real life scenario which I don’t think it is. 


ANYWAY other than that, it was a super fun read and I liked it! Four stars :)))))",4,6,2025-09-23,Immeandawesome,N/A,0.53
"Between Two Fires by Christopher Buehlman, a review.","Just finished *Between Two Fires*(2012) by Christopher Buehlman, a grim historical fantasy drama horror set in 14th century France, at the height of the Black Plague. 

The story follows a disgraced knight, a mysterious young girl and a struggling priest as they travel through a landscape ravaged not just by disease and war, but by the intrusion of demonic forces. Buehlman blends real medieval history with supernatural horror, creating a world where humanity’s suffering mirrors a cosmic battle between heaven and hell. It is dark, atmospheric and firmly rooted in medieval brutality. Full disclosure: The book goes heavy on religious Christian themes. 

Buehlman’s prose is one of the book’s biggest strengths. He writes with a lyrical poetic touch that still manages to capture the grit and filth of the era. The characters are written with enough depth, warmth, humanity and biting humour that its easy to become emotionally invested in their struggles even amid the bleakness of the world around them. Dialogue feels authentic without being overly archaic and his descriptions of both the plague-ridden countryside and moments of supernatural terror are vivid and haunting. The pacing and tone are deliberately uneven, certain passages are dense and slow, making the raw and shocking moments stand out. 

Pick it up if you are drawn to dark, atmospheric tales that mix history with the supernatural, where diseased landscapes, questions of faith and glimpses of hope intertwine. Its not flawless, on a couple occasions the book does stumble under the weight of its ambition, but its vivid writing, memorable characters and unsettling blend of horror and humanity make for a compelling rewarding read. 

8/10",35,27,2025-09-22,Zehreelakomdareturns,N/A,0.81
Just read The Old Man and the Sea by Ernest hemingway,"Normally, I like the books that has too much sadness, inner conflicts and situations that makes you feel there is no way out and all the life has to offer is endless pain and suffering. (recommend me books of this sort, please...)

But when my friend gave me this book, I didn't think much. I thought it's some nice, normal story about the old man and his struggles but it was nothing like that.

I can't say that this is the saddest book that I have read but it's sad enough if one can imagine the pain of his bad luck even though he likes to strike it off with humour and I like how the book ended. It is realistic. Santiago has it hard and I deeply respect and admire such people who are never recognised by society but suffers a lot.",276,73,2025-09-21,vinay1668,N/A,0.91
Dick Francis makes the horse-racing world come alive,"I just finished reading Longshot, published in 1990. I have a huge collection of Dick Francis books, but somehow missed reading this one until today. My first introduction to this outstanding author was as a teenager. The book was titled Nerve, and was one of four novels in a Reader’s Digest condensed book. Mr Francis is incredibly knowledgeable, and even though Murder is usually part of the plot, his descriptions are magical and his characters are realistic and sympathetically written. If you love horses, or just love crime fiction, this is an author you don’t want to skip ",100,57,2025-09-21,Traditional-Cress813,N/A,0.91
"Weekly Calendar - September 22, 2025","Hello readers!

Every Monday, we will post a calendar with the date and topic of that week's threads and we will update it to include links as those threads go live.  All times are Eastern US.

---

Day|Date|Time(ET)|Topic|
-|-|-|-
^Monday|^(September 22)||[^(What are you Reading?)](https://redd.it/1nnic86)
^Wednesday|^(September 24)||^(Literature of Guinea-Bissau)
^Thursday|^(September 25)||^(Favorite Blasphemous Books)
^Friday|^(September 26)||^(Weekly Recommendation Thread)
^Sunday|^(September 28)||^(Weekly FAQ: What are your quirky reading habits?)",2,0,2025-09-22,Reddit_Books,meta,0.6
"Which Childhood Novels Taught You About A Moment In History (and incidentally, where did you first learn the word ""pogrom""?)","I think I learned everything I know about history from the books I read growing up. I know I did history in a British high school but I can't remember much of what we studied except the jovial history teacher laughing ""The Cavaliers were wrong but romantic. Roundheads were right but not romantic"". I learned about the French Revolution and Napoleon from *Desiree,* about the American Civil War from *Gone With the Wind*, and *North and South,* and I believe my first introduction to WWII was through *The Silver Sword,* and then of course, *Goodnight Mr Tom,* and then *The Machine Gunners*. Yeah we did a lot of WWII in school too, but I literally cannot remember any of it expect that the British were awesome and the Nazis were evil. Versailles.

*Voyage.* By Adele Geras. I must have been thirteen back then. It followed the fourteen days on a transatlantic ship carrying Jews fleeing the violent anti-Semitism of East Europe, heading to a new life and hope in America. That's where I learned what pogroms were, I only remembered this the other day because on a different Reddit thread, people were discussing where they first learned about this word, and I thought back, and I remembered this book.

 damn, I wish that book had half as much acclaim and fame as goddamn *Titanic.*

I can't actually remember if the text of the story itself contains this word, or whether it appears in the description. The story certainly has very awful and very vivid descriptions of actual pogroms and murders which has stuck with me to this day. Actually, the old paperback copy is on the windowsill of my son's bedroom, yellowing and curling, one of my handful of precious childhood books that I brought with me to Canada after leaving my beloved but volatile home country, so I can probably go check. I could do that right now, I guess.",90,179,2025-09-21,1000andonenites,N/A,0.8
"Publishing’s New Microgenre: This year, dozens of books are principally concerned with AI.",N/A,98,8,2025-09-21,AmethystOrator,N/A,0.92
Just read Castle in the Air (howl's moving castle 2) and it was pretty good.,"About two-thirds of the story is about a man named Abdullah who goes on a quest to save a princess with a magic carpet. So I thought the story was going to be like Aladdin, especially since he even gets himself a genie. I was also a little disappointed that the main characters from the previous book weren’t in it. But since it’s set in the same world, I assume we would see them later.and I was wrong, turns out they were always hidden under my nose, i just couldn’t see them. The author really hid them well, it's a really good plot twist. I was honestly shocked by it.

Overall, it was a good read, and I’m going to try the third one when I have more time.",126,23,2025-09-20,thetruememeisbest,N/A,0.95
Okay A Little Life is mildly overrated—,"I read it yesterday and while I did ALMOST shed a tear (if I was being more cynical I probably wouldn’t have even winced but I was in the mood for crying), I almost instantly forgot all about it! And considering the emotional reaction it produces is the only strength of the book beyond writing strong friendships between two of the characters and abandoning the rest, this thing isn’t really that impressive? Which is depressing(more depressing than the book ngl) cause every person I’ve seen rate it rated it like 5000 thousand stars and called it their favourite book of all time.


Basically there’s a difference between summoning tears and actually being a good book, a differentiation a ton of people seem to cheerfully miss—- probably because no book would be five stars in that cause, and fair enough, but also idk I didn’t want to read this and why did so many people say it was g o o d cause I *reaaaally* didn’t want to read this—


Not to mention ending at any point before the actual end would’ve improved it cause wow is that a depressing ending with no actual point. I would’ve even taken a sudden stop without any explanation because half my issue with this thing, beyond no friendship development (I won’t mention the trauma being unrealistic because I suppose it is possible if you have very bad luck like REALLY bad luck and idk enough about that to rebut it), is that the overall message made by the ending of the book just. doesn’t exist? And if it does, it’s *wrong* like the message is literally *wrong* which is arguably worse. 


Anyway ew I rated it 3 stars because the writing is pretty and Harold is cool and anything less would’ve been me being resentful of the ending but also not saying the ending doesn’t deserve that??


Okay that’s it bows ",78,113,2025-09-20,Immeandawesome,N/A,0.67
Charlie Sheen Tells All in Debut Memoir ‘The Book of Sheen’,N/A,0,16,2025-09-22,ubcstaffer123,N/A,0.33
Which genre would you like to be popular after Romantasy has settled down?,"Based on how long previous genres have remained dominant, Romantasy will remain popular until ~2030. I assume after a fantasy boom, it'll be followed by some contemporary boom, like how John Greens books blew up after YA Distopian died down. But if you had a choice, which genre would you like to dominate next?",304,431,2025-09-20,justkeepbreathing94,N/A,0.86
Book ban spirals as district bans hundreds of titles,N/A,1444,197,2025-09-20,zsreport,N/A,0.94
"Simple Questions: September 20, 2025","Welcome readers, 
        
Have you ever wanted to ask something but you didn't feel like it deserved its own post but it isn't covered by one of our other scheduled posts?  Allow us to introduce you to our new Simple Questions thread!  Twice a week, every Tuesday and Saturday, a new Simple Questions thread will be posted for you to ask anything you'd like.  And please look for other questions in this thread that you could also answer!  A reminder that this is not the thread to ask for book recommendations.  All book recommendations should be asked in /r/suggestmeabook or our Weekly Recommendation Thread.
        
Thank you and enjoy!",15,19,2025-09-20,AutoModerator,WeeklyThread,0.89
