title,text,score,num_comments,created_date,author,flair,upvote_ratio
"Weekly Recommendation Thread: September 19, 2025","Welcome to our weekly recommendation thread!  A few years ago now the mod team decided to condense the many ""suggest some books"" threads into one big mega-thread, in order to consolidate the subreddit and diversify the front page a little.  Since then, we have removed suggestion threads and directed their posters to this thread instead.  This tradition continues, so let's jump right in!

**The Rules**

* Every comment in reply to this self-post must be a request for suggestions.

* All suggestions made in this thread must be direct replies to other people's requests. Do not post suggestions in reply to this self-post.

* All unrelated comments will be deleted in the interest of cleanliness.

____

**How to get the best recommendations**

The most successful recommendation requests include a description of the kind of book being sought.  This might be a particular kind of protagonist, setting, plot, atmosphere, theme, or subject matter.  You may be looking for something similar to another book (or film, TV show, game, etc), and examples are great!  Just be sure to explain *what* you liked about them too.  Other helpful things to think about are genre, length and reading level.

____

All Weekly Recommendation Threads are linked below the header throughout the week to guarantee that this thread remains active day-to-day.  For those bursting with books that you are hungry to suggest, we've set the suggested sort to new; you may need to set this manually if your app or settings ignores suggested sort.

If this thread has not slaked your desire for tasty book suggestions, we propose that you head on over to the aptly named subreddit /r/suggestmeabook.
               
- The Management",10,105,2025-09-19,AutoModerator,WeeklyThread,0.76
"Weekly FAQ Thread September 21, 2025: Best way to choose the best version/translation of a book?","Hello readers and welcome to our Weekly FAQ thread!  Our topic this week: How to find the best version/translation of a book?
              
You can view previous FAQ threads [here](https://www.reddit.com/r/books/wiki/faq) in our [wiki](https://www.reddit.com/r/books/wiki/index).
             
Thank you and enjoy!",9,5,2025-09-21,AutoModerator,WeeklyThread,0.78
Do you think the way we read has changed more than the books themselves?,"I have been thinking about how my own reading habits have shifted over the years, and I wonder if others feel the same.

When I go back to older books, even classics that people have read for generations, I realize the words have not changed, but my way of engaging with them has.   
  
Growing up, I used to read slowly, re-reading passages, letting the story live in my head for weeks.   
  
Now, with so much digital content and endless scrolling, I notice I rush more. I look for fast payoffs, quick moments of impact, and I sometimes lose patience with slower sections.

It makes me wonder: are modern books really that different, or is it our attention that has changed?   
  
Are we demanding tighter plots and faster pacing because our own focus is fractured?   
  
Or do we just interpret older books through a different lens now, influenced by the way we consume media every day?

I would love to hear from you:

1. Have you noticed your reading style changing with time?
2. Do you think the shift is in the books being written today, or in us as readers?
3. And what do you do to slow yourself down and let a book breathe again?

Curious to hear how others see it.

Thank you.",240,107,2025-09-24,gamersecret2,N/A,0.92
Recommended by Dad?,"Are there any books your father asked you to read, because they were important to him? There were two for me, recommended when I was about 14.

The first was Dandelion Wine, Ray Bradbury's ode to boyhood. The second was, and still is, the most sentimental novel I have ever encountered: **Greenwillow, by B.J. Chute**.

It is set in a small town, somewhere outside of the flow of time, with two preachers. The stern Reverend Lapp, and Reverend Birdsong, who just shows up one day, full of sunshine and promise. There is also a seemingly doomed love story between Dorie, who will never leave the town, and Gideon, whose family curse will force him to wander. The story is tender, but full of humor too (and a toothless Granny who gnaws on raw turnips all day).

These two books showed me a softer side of my dad. Please tell me what books your father shared with you. But also, read Greenwillow -- it's a strange and wonderful book.",89,203,2025-09-25,Bellsar_Ringing,N/A,0.9
"North Woods by Daniel Mason, a review.","Just finished reading *North Woods*(2023) by Dr. Daniel Mason who is a psychiatrist, a literature professor at Stanford University and also does some excellent writing on the side. 

Just like the author, *North Woods* is a genre defying novel that eloquently spans 400 years of history in a small wooded clearing in Western Massachusetts. The premise is simple yet profound: A house built by two runaway lovers in the wilderness becomes the silent witness to the passing of time. Across generations, its walls shelter Puritan settlers, artists, fugitives, revolutionaries, farmers, scientists, dreamers and spectral presence(s). Their stories forgotten by people but remembered in vivid detail by the land. 

What makes the novel compelling is its structure. Instead of focusing on one protagonist, Mason lets the house itself bind the narrative. Each chapter shifts its form (eg. letters, songs, field notes, ghost stories), while also bringing a fresh kaleidoscopic perspective, sometimes through the eyes of human characters, other times from the experience of animals, insects or plants, lending the story an immersive ecological depth. The house in the woods becomes a living character itself, witnessing love, envy, betrayal and loss, embodying both sanctuary and confinement. The result is less about plot in the traditional sense and more about the interconnection of time, nature and the human experience. 

Mason's poetic prose skillfully blends historical fiction with elements of Gothic mystery and magical realism adding an otherworldly feel without overwhelming the grounded emotional reality of the characters. One of its strongest aspect is the seamless integration of human history with natural cycles, raising profound questions about the fragility and resilience of life. While the pacing may feel slow at moments due to its vast time span and reflective style, the book’s multi-voiced structure, literary ambition and deep empathy for its characters make it a strikingly original unforgettable reading experience, rich with insight and beauty.

Highly recommended for readers who love sweeping historical fiction, lyrical nature descriptions, ghostly atmosphere and inventive storytelling that lingers long after the last page. Daniel Mason has confirmed his status as a master storyteller in my heart with this profound and haunting work, definitely making the top 5 among the 50 odd books I have read this year. 

8.5/10
",133,37,2025-09-24,Zehreelakomdareturns,N/A,0.94
The Booker shortlist honors authors 'in total command' of their craft,N/A,140,15,2025-09-24,zsreport,N/A,0.89
"Going home: Theodore Sturgeon's ""A Way Home"".","Whelp, read my first ever collection of stories by Theodore Sturgeon! This one is a collection from the 50s titled ""A Way Home""

It's a very nice and tidy little collection of stories, at least about in total. Most of the stories in this collection are on the longish side, novellas of course, and there were at least a couple of shorter ones too. And all nine of them were pretty good!

Sturgeon is one of those writers of the golden age that I've never read before, but was very interested in his work. And when I got to read one of his stories in Ellison's ""Dangerous Visions"", I pretty much wanted to read more of his stuff, and so I began to keep an eye out for his stuff whenever I'm in a used book store.

Best way I can describe Sturgeon's style as writerly. Probably not in the sense of mainstream fiction, but more in the sense of a few other golden age writers like Ray Bradbury and Henry Kuttner, so something more along the lines of stylist. Very easy to see him as an influence to New Wave SciFi that would come a decade later, as he mixes both action and social commentary into his stories.

He's written a few novels (and I love to get my hands on some of those!) but he's much more well known for his short stories as there are quite a lot of collections! If I ever see another of his collections, or at least one of his novels, I'm swooping in and picking it up!",3,1,2025-09-25,i-the-muso-1968,N/A,0.67
Books by Bots | American Libraries Magazine,N/A,5,1,2025-09-24,ubcstaffer123,N/A,0.65
"George Takei to lead Banned Books Week, urging the fight against censorship",N/A,18891,335,2025-09-23,AmethystOrator,N/A,0.95
Literature of Guinea-Bissau: September 2025,"Receber readers, 
        
This is our monthly discussion of the literature of the world!  Every Wednesday, we'll post a new country or culture for you to recommend literature from, with the caveat that it must have been written by someone from that there (i.e. Shogun by James Clavell is a great book but wouldn't be included in Japanese literature). 
               
September 24 was Independence Day in Guinea-Bissau and, to celebrate, we're discussing Bissau-Guinean literature!  Please use this thread to discuss your favorite Bissau-Guinean literature and authors.
                
If you'd like to read our previous discussions of the literature of the world please visit the [literature of the world](https://www.reddit.com/r/books/wiki/literatureof) section of our [wiki](https://www.reddit.com/r/books/wiki/index). 
               
Obrigado and enjoy!",16,4,2025-09-24,vincoug,Literature of the World,0.94
Another Jonathan Strange and Mr Norrell post,"I just finished this (I know, behind the times). I won’t go into details of why I didn’t enjoy the book, but I did have one glaring issue with it. >!If all the enchantments done by the man with the thistle down hair ended when he was killed, why did the Tower of Darkness and the enchantment on Strange and Norrell persist?!<",0,6,2025-09-25,willreadforbooks,N/A,0.42
Independent bookstores are having a boom. Texas is leading the charge.,N/A,913,59,2025-09-23,zsreport,N/A,0.97
Boy's Life is is an instant classic.,"Wow. This book. Just wow. Boy's Life is one of the most magnificent books I've ever read, and might be the best book I've read this year. McCammon has written a masterpiece that should stand next to the best coming of age books ever written. Heck, in my opinion, this is a book that could be read in literature classes because of the depth it has with its themes. Boy's Life is a beautiful book, oftentimes bizarre, but magical the entire time. About 30 pages into the book, I already had the feeling that this one was going to be special, and the book proved me correct. Boy's Life pulls elements from a lot of different places: it has elements of southern gothic like Flannery O'Connor, coming of age themes and concepts of race and human dignity like in To Kill A Mockingbird, and also moments of horror similar to Stephen King. One of my favorite parts about this book was this overwhelming sense of nostalgia and childhood that suffuses the entire novel. I found myself reflecting on my own childhood and what it means to grow up, and wow, so many of the scenes just kept sticking with me the entire time I read this and they'll continue to stay with me long after. McCammon's character development is on a masterclass level here, his prose is stunning and is capable of weaving so many threads together, there are many emotional moments and I was moved to tears multiple times during my read, and I don't even know what else to say other than I LOVED this book. If you like coming of age tales at all, this is an absolute must read. Boy's Life gets my absolute highest recommendation.",149,49,2025-09-23,laudida,N/A,0.89
The shortlist for the Booker Prize 2025 has been announced,N/A,201,81,2025-09-23,misana123,N/A,0.94
Rereading Wuthering Heights in 2025 is so disappointing…,"I read this book as a teenager and thought I had fond memories of it, possibly I had over romanticised the story.  With the new film coming out soon, I decided to reread it and was astonished to find it is melodramatic nonsense, that all the characters are extremely dislikable, it portrays extremely abusive relationships, that Heathcliff is a toxic, violent bully and that the female characters are portrayed as victims and spoilt princesses with a tragic fate.  Don’t get me started on these vague illnesses and deaths that half the characters suffer conveniently or the patronising way the working class servants are written.  The entire story is as bleak as the landscape it is set in.  This could put me off rereading classics.  What is your opinion of this book in 2025?",0,35,2025-09-25,Verystrange129,N/A,0.43
Faulkner’s “Sanctuary”: overrated?,"I just couldn’t feel there was anything of value gained by reading this book. On just about every level. But it’s what made Faulkner’s name, so apparently not everyone is as repulsed as I was.

One of my first objections was the characters’ tendencies to not complete their thoughts.  The book required a LOT of reading between the lines. As far as I can tell, this was the only novel aspect of his literary style, but I didn’t care for it. 

One of the protagonists in the story, the “fast girl” Temple, spends the first half of the book running in panic from one bedroom to another, and the second half of the book getting alternately raped and then drunk. 

The other protagonist, the ineffectual lawyer Horace, misjudges everyone and everything in the murder case he gets sucked into. 

By the end of the novel both Horace and Temple go away, and neither of them seems to care about what they went through. 

Faulkner himself once dismissed the novel as a “potboiler.” Is it anything but? What am I missing?",0,5,2025-09-25,cja1968,N/A,0.36
Feeling a lot like 2018 tonight,"It's feeling a lot like 2018 tonight as I find myself enjoying the pages of INJUSTICE: GODS AMONG US VOL 2 issue #2 in which Kalibak opens a boom tube above Superman, out of which pours more Apokolips warriors than I can count. (Something tells me things won't end well for Kalibak though, and I don't expect Kalibak to be surviving long enough to appear in issue #3.)

Having never played the INJUSTICE video game, I do find it interesting to actually be reading comic books based on a video game I never played, while the tale being told in the comic books begins five years prior to the tale in the video game. When it comes to being a reader, I suppose there really is a first time for everything. 

I'm really enjoying these INJUSTICE comic books overall. I already sort of knew that I would, because Taylor writes cool stuff. I wonder which other tales of his I ought to be on the lookout for.",0,4,2025-09-25,SonnyCalzone,N/A,0.23
Book reviews: ‘Listening to the Law: Reflections on the Court and Constitution’ and ‘Dark Renaissance: The Dangerous Times and Fatal Genius of Shakespeare’s Greatest Rival’,"...If you hoped the book would help you get to know Barrett herself, you’re out of luck, said Jennifer Szalai in *The New York Times*. The former Notre Dame law professor and mother of seven “clearly knows that readers crave relatability, especially from women, so she offers a few breadcrumbs.” Still, “she’s not about to let her guard down, even for a reported $2 million advance.” ",4,1,2025-09-24,PsychLegalMind,N/A,0.61
Libra by Don Delillo - Is there a deeper message being conveyed?,I just finished reading Libra by Don Delillo which I thought was great! However I'm having a difficult time finding a deeper meaning/message. Was the book simply meant to read as a fun hypothesis as to what may have happened? Or is there something more there? Fate and the idea of pre-destiny is obviously a major theme but I can't help but feel like I might be missing something. ,6,8,2025-09-23,BaconBreath,N/A,0.63
"""Lost Horizon"" - what I didn't notice as a kid","I just reread ""Lost Horizon"" (the book that introduced Shangri-La, an almost-magical Tibetan Buddhist monastery hidden from the world) for the first time since high school. It was incredibly popular book from 1933 when it was written up through the 70s, when I read it and it was adopted by the New Age movement.

I was startled at its aura of Kipling's ""take up the white man's burden"" that seemed perfectly reasonable to me at the time. 

Sometimes re-reading books casts an unflattering light on your own past.


Spoiler: 

The monastery was founded by a Frenchman and German, run by a Frenchman, and he decides to hand it over to a British guy who's been there for a few months rather than the locals who've been studying for decades to be monks, because Chinese and Tibetan people don't have the right attitude. There's a lot of talk about music but it's entirely about European composers, often using a harpsichord and a grand piano hauled in over the Himalayas by native porters.

The fact that I accepted all this as reasonable says something about my attitude at the time, which I think reflects society's attitude at the time. I hope my attitude has changed even if that of parts of society haven't.

It goes without saying that all the major characters are men except one sexually repressed British missionary for comic effect and a sexy young Chinese girl who acts as a love-interest McGuffin.
  
 


 ",105,10,2025-09-22,GraniteGeekNH,N/A,0.87
"After 50 Years, Jeffrey Archer Caps His Pen: ‘I’m Writing My Final Book’ (Exclusive)",N/A,198,30,2025-09-22,Remarkable-Pea4889,N/A,0.89
Sloppy editing,"I just finished a contemporary romantasy which will remain nameless.  The author is a New York Times bestselling author with a stack of previous novels under her belt.  This book was put out by a mainstream publisher (Ace).  It was a fun book, well plotted, engaging, no complaints on that score.  But the line editing was….lacking.  There were a couple of times where I’m pretty sure a line of dialogue was included twice within a couple of pages by mistake (once I even thought ‘is there a time travel component to this?’ because the scene seemed to skip backwards.  And the prose had a bunch of minor grammatical errors which are the type of thing that people say when speaking colloquially but aren’t usually seen in this type of writing (first person, past tense, straight up, nothing experimental). I mean along the lines of ‘having been’ used in the  ‘wrong place’. Not egregiously wrong but enough that as I was reading I took out my mental red pen and rewrote lines multiple times.

I recently read a bestselling leadership book in a second edition that had a number of similar errors, definitely things that should have been caught before going to press.

What’s up?  Is this the way things are now, and if an author want a decently edited book they have to make sure it happens on their own?  Or is it just a coincidence that I’ve hit two books like this in a row?",74,54,2025-09-22,FlipDaly,N/A,0.8
"Lonesome Dove, lonesome now","60F UK female here who loves to read books considered classics. This kept popping up as one that must be read. Had given this a swerve though as it’s about cowboys and ranches and horses and so on and so on. Eventually took the plunge based on reviews on Reddit. 
Have just finished it. What a book!!! I actually feel a little bereft that it’s over. 
What this novel demonstrated for me (amongst other things) is it really doesn’t matter when you live, where you live and what your circumstances are, human nature with all its foibles, its meanness, its random acts of kindness is the same wherever you are. 
The richness of these characters, the incredible narrative, the shock of some of the happenings. This is one book that will stay with me forever. 
Now, do I just accept that nothing will beat this or tackle the prequels and sequels?


",440,131,2025-09-22,RelationKindly,N/A,0.95
What are your favorite banned/controversial books?,"Depending on where you live, it might be hard to actually read banned or controversial books, but if you've read any - what book stood out to you? 

I enjoy reading books that are controversial or banned in other countries, I believe they are important to read - partly because no book should be banned and partly because it is the controversial topics that usually lead to a difference, be it in society or in your way of thinking. I also enjoy reading them because it is a way for me to practice my freedom of information and speech. 

I've read some of the classics, such as Catcher in the Rye, some George Orwell, Farenheit 451, Metamorphosis, a lot about the Holocaust and I started reading 120 Days of Salo but didn't finish it (language was hard to read). While I did enjoy them all and found them important to read (maybe arguably not Salo), I kind of already knew what they were about so I wasn't too surprised at the plot (except Metamorphosis - had no idea what it was about, definitely more fun reading when I had no idea what to expect). 

Are there any banned/controversial books you've read that you've found to be very rewarding? Or maybe a book you enjoyed a lot and later found out that it is banned or deemed controversial in another country? ",98,183,2025-09-22,Funkiebastard,N/A,0.79
"Simple Questions: September 23, 2025","Welcome readers, 
        
Have you ever wanted to ask something but you didn't feel like it deserved its own post but it isn't covered by one of our other scheduled posts?  Allow us to introduce you to our new Simple Questions thread!  Twice a week, every Tuesday and Saturday, a new Simple Questions thread will be posted for you to ask anything you'd like.  And please look for other questions in this thread that you could also answer!  A reminder that this is not the thread to ask for book recommendations.  All book recommendations should be asked in /r/suggestmeabook or our Weekly Recommendation Thread.
        
Thank you and enjoy!",4,15,2025-09-23,AutoModerator,WeeklyThread,0.64
Any books you enjoy but despise the main character?,"Anyone here ever read a book that you enjoy the setting, the majority of the characters, as well as the plot. Then the MC steps in and just rubs you the wrong way?

For me, the book is called He Who Fights With Monsters and the MC's name is Jason Asano. The cringiest, neck beardiest sounding character I've ever tolerated so i could finish an otherwise decent book.",237,463,2025-09-22,slyguy-33,N/A,0.91
