title,text,score,num_comments,created_date,author,flair,upvote_ratio
The 'Westmark Trilogy' by Lloyd Alexander,"If Lloyd Alexander is remembered for anything, it's probably his *Chronicles of Prydain* series; a pioneering cycle of children's fantasy novels based on Welsh mythology. Famous for its whimsical humor, solid storytelling and incredible characters, the first book was released in 1964 (one year before Tolkien's *The Lord of the Rings* would officially be published in paperback and launching a global phenomenon) and was concluded in 1968 (with some supplemental material interspersed). Both the second volume (*The Black Cauldron*) and the final volume (*The High King*) won the Newbery Award for best children's literature (don't worry, no dogs die in them). It also, rather notoriously, was the inspiration for Disney's animated box office bomb *The Black Cauldron* (though I love that movie to bits).

But Alexander was a prolific author, and he wrote dozens of other books over his career. In particular, he wrote a trilogy of quasi-fantasy/quasi-historical novels called the *Westmark* trilogy.

These three books may very well be Alexander's crowning achievement in literature for young people, and yet it sadly did never get the recognition of *Prydain* (though the first book, *Westmark*, did win the National Book Award for children). It takes place in what can only be described as 'not-France' (called Westmark) during the twilight years of the 'not-Ancien Regime', where the people are becoming increasingly fed up with their stodgy and corrupt monarchy. Revolution is in the air, and a young printer's devil named Theo gets caught up with a group of con artists after nearly killing a King's Inspector in a scuffle. At the same time, the aging and grieving King (who has not gotten over the apparent death of his daughter) is being manipulated by his Chief Minister (named Cabbarus) into conceding more and more power to him, while the Queen and her court physician are actively attempting to curtail Cabbarus's schemes.

Then Theo and his group come across a charismatic republican activist named Florian, and things get *really* interesting.

What's so astonishing about these books is their ideological and moral depth: the nature of violence and its morality in the service of freedom and political change is a constant theme that comes about. Florian, a staunch liberal and republican, is convinced that the monarchy is stifling their country and actively holding it back from progressing, and he views a violent conflict between the Monarchy and the people as an inevitability. The Queen's physician, a man named Doctor Torrens, is a staunch conservative and monarchist who, while acknowledging the crimes of Cabbarus in the King's name, simply cannot let go of the centuries of culture and perceived stability that the monarchy provides. Both men are portrayed as morally good, and both are allowed to give equally compelling arguments on their stances. 

Then things get serious in the second volume, when the neighboring state of Regia invades. We get several scenes of war, and for children's literature it is *grim*. Alexander himself served on the Western Front during WWII, and he brings a degree of realism that is, quite frankly, shocking in its down-to-earth yet compassionate approach. Even when the revolution happens and we get a Robespierre-like figure named Justin, even he is not portrayed as wholly evil (because in spite of everything, he isn't *wrong)*.

And remember: these are *children's books* I've been talking about.",86,12,2025-09-20,Adonisus,N/A,0.99
Anti authoritarian books,"B&N in my city has a nice prominent section full of all these types of books on display so you can get all your anti-authoritarian lit in one place. Some good ones I’d recommend:

they thought they were free (Mayer)

This is a great book. A journalist travels to post Nazi Germans to interview 10 normal dudes in a small town from different walks of life, seeking to understand how/why Germans fell to Hitler. It’s very unsettling and candid and demonstrates how there are no easy or satisfying conclusions. It does a good job showing you just how easy it is to become a bystander or even complicit when you’re just a normal person just with life.

the origins of totalitarianism (Arendt)

This is more of an academic study on the process of an authoritarian takeover. Literally nothing we are seeing now is new.

diary of a man in despair  (Reck)

This is a very personal recounting of a Prussian aristocrat who lived (and died, when the journal was discovered) in Nazi germany. He was an old school conservative and not really a fan of democracy or activist or anything like that, he just really, really hated Nazis/Hitler because of how they perverted society and destroyed traditions. A good short read for those coming from a centrist or conservative perspective.

on tyranny (Pinketty)

This is maybe the one you should get if you can get only one; it’s digestible and sources many primary documents to give you the hard lessons and anecdotes on what to do in the situation we presently find ourselves in.

There were many more books as well, but these are the ones I’d recommend. Read them and share so that we don’t waste the benefit of having historical context and hindsight.",260,64,2025-09-19,airbear13,N/A,0.84
Anna Karenina - I have mixed feelings after reading this novel,"I can start by saying that I really enjoyed this book and Tolstoy really nailed it when it comes to conveying all the emotions each character expresses, making them all feel real (The ice skating scene where Levin acted awkward around Kitty was so relatable lol). I also love how he portrayed the aristocratic society of Russia, the fancy balls, the social dynamics and the way he presented the scandals and gossip happening within.

The story itself was truly a journey. Tolstoy built the characters up with deep psychological understanding, precisely capturing their desires, problems, and their emotional connections towards one another. Like Anna, for example, started off as a respected woman in the society but as her story progressed, and the consequences of her actions (like the affair she had with Vronsky) came into fruition, she spiraled into a world of jealousy and delusion which deteriorated her mentally and ultimately led to her suicide (at a train station too, where she first met Vronsky, this really impressed me for some reason). The way Tolstoy wrote it had me sympathizing for her, he made me understand her point of view, even though I found some of her actions quite questionable like her rejecting the divorce Karenin offered when he even said that he was willing to do whatever would make her happy, even willing to give up his son for it (if I remember this part correctly), but I guess it was just her emotions getting the best of her.

However, as much as I enjoyed the story, I'd be lying if I said this book had no flaws. When I first started reading, I initially assumed that it would be centered around Anna. And it kind of was I guess, but it just really surprised me how a huge portion of the book focuses on Levin, which isn't really that bad I guess, I like Levin's character, he's relatable, a socially awkward fellow who overthinks just about everything, like me. What disappointed me about Levin though (or the story in this case) was the amount of farming talks that didn't really tickle my fancy. I guess it was good to have some perspective on things like that, but for a book that seemed to focus on Russian aristocratic society during that era, I feel like Tolstoy went a bit too detailed when it came to the agricultural portion of the book,.

Another thing I'd like to mention was how disappointing the ending was. The build-up of Anna's story was really well-constructed and the suspense kept growing as Anna herself descends into an emotional and mental deterioration, but the moment she commits suicide, that was it. I guess we did get a glimpse of how it affected Vronsky and it obviously devastated him, but that was all there is to it. I expected part 8 to be all about her death and the reactions of certain characters, especially Karenin, their child Seyrozha (That was his name I think), Darya and even Kitty. But instead, it was like Anna served her purpose and was immediately set aside for Levin and his philosophical questionings and existential crisis, which isn't that bad in itself because I do kind of enjoy watching him contemplate about life, but still it sucked because it wasn't the ending I (or I assume everybody else) expected. Now that I mentioned Levin, anyone else feel like his brother's death was more explored than this?

This was also my first time reading Tolstoy so I'm not sure if this is his typical writing style but it left me heartbroken :( I was deeply impressed by the emotional weight Anna’s character was carrying, but was left unsatisfied by how sudden she was set aside. But above all, I enjoyed the book. It was an adventure, a journey through the lives of unique and interesting characters and how they've progressed throughout the story. However, as I neared the ending, I couldn't help but feel really disappointed. The emotional momentum was built so intensely, but the final chapters didn’t quite deliver the ending I was hoping for.

So a question to those who've read the book, what did you think of the book after you've read it? I would really like to hear your opinions.",65,67,2025-09-20,RecordWell,N/A,0.77
The Divine Comedy - Is it normal to feel detached from everything being said or am I missing something?,"Sorry if this is dumb, but for reference, I'm reading John Ciardi's Translation of the Divine Comedy. I'm on Canto XXXII of Inferno: Circle Nine. And while I find it funny at times, I feel very detached from it all. I do not believe in any of this so that may contribute to my attitude but I have grown up in the US South so I have some cultural/religious reference. 

But I see people online raving about how it makes them feel and I just feel like I'm missing something. I do have depression but I don't seem to have this problem with other books, usually. People are being mauled and burned and having horrible things happen to them and I just don't feel anything about it. 

TL;DR: What is your experience with Dante's Divine Comedy? Is it normal to be very detached from it or do I need a better translation or something else? 

Thanks!

",28,48,2025-09-20,No_Instance18,N/A,0.64
"When you find what you like in a book, do you try to only read that thing or keep your horizons broadened?","The title sounds a bit clunky so let me explain. I recently discovered I like books set in a fantastical setting with a romantic subplot. I just finished a whole series and then finished another book like that and loved both so, so much.

I was given a bunch of recommendations based on my prompt which I’m going through since it’s the only type of book I want to read right now. However, I don’t want myself to be “burnt out” of this kind of novel from reading it so much. I’m reading a book from the same author but different series, and I’m wondering if I’m not seemingly enjoying it because it was her first (?) series, if I don’t like the premise in general, or if I’m reading too much of what I already enjoy, and it doesn’t feel “special” anymore.

So when you read and know what you like, do you actively just seek out that kind of book, or do you try to vary it to not get bored? Obviously, I’m not saying you should read books that don’t interest you, but are you reaching out for different genres?",28,68,2025-09-19,kuhteen,N/A,0.77
Librarians Are Being Asked to Find AI-Hallucinated Books,N/A,3218,307,2025-09-18,Jojuj,N/A,0.97
"Review for Unbound: A Woman’s Guide to Power by Kasia Urbaniak, a former dominatrix and Taoist nun.","Just finished Kasia Urbaniak’s *Unbound: A Woman’s Guide to Power* (2020) which is a transformative and provocative masterclass in reclaiming one's voice and agency. Her unique background as a former dominatrix and Taoist nun brings to the table a truly fresh perspective on power, which she defines not as dominance over others, but as the skillful ability to influence conversations and situations by mastering the flow of attention. 

What makes this book so compelling is its balance: it doesn't push aggression or manipulation, but instead teaches you how to hold power calmly, directly and authentically. Urbaniak shows how to move through the “freeze” response, ask clearly for what you want, and treat rejection as information rather than humiliation. I love how actionable the techniques are for transforming passive frustration into active pursuit and channeling emotions like rage into fuel for growth, which are applicable in every real life scenario. 

The book empowers without preaching. Urbaniak’s tone is warm, humorous and compassionate, making the lessons feel like guidance from a mentor rather than rules from a textbook. Her mix of storytelling, somatic practices and psychology resonates with anyone who has ever felt silenced, overlooked or hesitant to take up space.

While the anecdotes, examples and exercises have narrative that is addressed exclusively to women, the core principles are applicable to everyone. For men in particular, *Unbound* has surprising value. It dismantles the myth that you always have to be “in control” or have all the answers, showing instead that moments of doubt can be turned into strength. It teaches how to communicate with clarity and presence, build authority without hostility and how to form and strengthen connections. Most importantly, it presents a small window for men to observe the ongoing challenges women face while expressing their voice providing an opportunity to understand them better. 

Ultimately, *Unbound* is not just a book about women reclaiming power, its a guide for anyone who wants to step into their voice, set boundaries with confidence and engage authentically with others. Its a rare blend of practical, psychological and embodied wisdom that leaves you feeling stronger and more connected.

9/10",23,9,2025-09-19,Zehreelakomdareturns,N/A,0.69
My particular response to Never Let Me Go (Spoilers),"Most of what people say about this book concerns their reaction to the science fiction element. I too found it quite affecting, but the greater reason why the novel reached was the mundane half. Specifically, the fact that Ruth is godawful.

Dishonest, cruel, unreasonable, prone to self-serving misrememberings of the past - I think it’s safe to suggest that everyone’s known someone like her. The presence a character like Ruth serves to harm a story for many readers who strongly desire likeable characters, and do not desire to read about infuriating ones. Me, I eagerly want to read about dirtbags who remind me of unpleasant sorts I’ve had to deal with in my real life. I feel validated, a little less lonely knowing that the author, too, is bothered by the kinds of everyday dickishness that get under my skin.

And I don’t think this is a minor part of the book. I think the book gains a huge amount of power by counterposing a vast, horrific society-wide evil against the petty harms inflicted by one girl against her friend and lover, a whole school against one awkward boy. Ruth’s mistreatment forms the big emotional thrust behind much of Kathy’s recollection of her life - yet the background evil of organ farming bubbles in through Ruth’s conflicts with the others. Because Ruth is the only student who seems bothered by being human livestock. Maybe it’s because in being more self-centered, she is more perceptive to injustice being committed against her. Maybe she’s mean as coping mechanism to deal with the horror. Regardless, it’s a uniquely deft way of observing how the lives of individuals interact with big, sociopolitical things.

The book seems pessimistic about these things. But I leave the experience a little happier, a little more able to make sense of the Ruths I meet.",19,14,2025-09-19,PM_BRAIN_WORMS,N/A,0.65
Books that unnerve you so much you can't really start them?,"I can't be the first person to find a book that I just can't even finish the first chapter. Even thinking about the first few pages gives me the hibbie jibbies. A book that I see positively praised and I want to read it, but I just can't get over what happens and what some reviews say happen latter.

I never thought I would encounter a book like that. I thought I was desentized to fiction enough. But recently, it feels like my empathic circuits are in overdrive. (This was happening before my grandma's recent heart attack, but the attack really brought these feelings to the forefront).

For me, that book is Xenogensis/Lilith's Brood by Octavia E. Butler.

First chapter spoilers: >!The whole book starts with a woman waking up who has been abducted, forced under anesthesia, forced to have surgery for who knows what reason, forced to experience a dozen ""awakenings"" with no clothes and sometimes not even a bathroom. Treating her like an animal.!<

After reading some reviews I find out later in the story there is >!forced pregnancy, possibility without actual rape cause crazy alien tech. I'm a guy and that whole idea gives me the heebie jeebies.!<

To anyone else who has encountered a similar difficulty, did you push through it, or just DNF? 

Any advice on how to push through. The book gets a ton of praise for it's insight into actual *alien* alien species.",263,345,2025-09-18,SvalinnSaga,N/A,0.89
My review of The Covenant of Water,"The first part like everyone else has said was BRILLIANT. When the story shifts abroad to Digby I was like wait what? It felt a little disjointed until later on when Digby meets Rune etc.

As an Indian, it felt unlikely that a cook would make samosas and chicken kurma in Madras in the early 20th century. Samosas are primarily a north Indian snack, not a south Indian one especially in that era. Philipose had great potential when he was younger, I got annoyed at his behaviour after marriage, especially >!post Ninan's death!< but then he redeemed himself by becoming more dedicated to his work and being a very loving father to Mariamma.

I liked Elsie a lot initially but then I started disliking her. I wonder how Rune didn't consider that as a young kid who visited St.Bridget's often, she was >!at risk of contracting leprosy especially because kids' immune systems aren't that strong.!< 

Then when she's older and gets married to Philipose, she could've voiced her frustration about his >!opium addiction!< and her other worries at the very least. She gave up totally on her marriage which is kind of understandable, but she didn't even try to vent her angst to anyone in the family like Big Ammachi. Somehow I didn't get the impression that she was really into Digby..even though she says so in her communication with him. It felt more like she thought it was a good idea to be with him. Even when she was with Philipose I just had this deep seated feeling that she didn't truly love him..

Regarding >!The Condition, I honestly felt it was more like a mix of thalassophobia, vertigo and Von Recklinghausen's.!<

I loved most of the characters like Big Ammachi, Big Appachen, Baby Mol, Shamuel, etc. Damodaran was a special highlight, I would always look forward to his appearances. 

I'd love to hear what you guys think about the book!",8,8,2025-09-19,cloudwalker_11,N/A,0.8
"North Dakota releases first updated tribal textbook, with more on the way",N/A,329,20,2025-09-18,zsreport,N/A,0.97
How do you get the author's voice out of your head when reading a book?,"This is a novel issue I have.  Youtube started serving me episodes of Brandon Sanderson's podcast.  I watched a couple and a couple became alot.  I really enjoy it and it has been great for escaping the horrible stuff going on in the world.

I ended up buying Mistborn and started reading it.  But when I read it its not in my voice but I'm hearing Sanderson narrate it in my head.  My mind is even recreating his cadence and tone.  Its really off putting and I think I may have a budding parasocial relationship developing with Sanderson.

I'm not an avid reader but I read lots of fantasy books and I always meant to read him but never got around to it.  Now I am and I feel like I got in the wrong way; not through his work but through his opinions.  How do I work through this because it feels really weird—like I'm not alone in my mind.",5,67,2025-09-19,Mattson,N/A,0.54
Favorite Books with Pirates: September 2025,"Yarrr mateys, 

Tomorrow be [Talk Like a Pirate Day](http://www.talklikeapirate.com/) 'n t' celebrate we be discussin' books wit' pirates!  Ye scalleywags can natter 'bout books 'bout pirates, wit' pirates, or anythin' to do wit' piracy!
If you'd like to read our previous weekly discussions of fiction and nonfiction please visit the [suggested reading](https://www.reddit.com/r/books/wiki/r/booksrecommends) section of our [wiki](https://www.reddit.com/r/books/wiki/index).

Thank ye 'n enjoy!",66,73,2025-09-18,AutoModerator,WeeklyThread,0.91
The Book Thief,"I just finished this up and I quite enjoyed it. So im on lexapro and its really hard for me to cry but at the end i had tears. Not full on sobbing but I was crying. The way Death gave spoilers too, surprisingly didn't irritate me. I felt for Liesel, I was hoping more for her. But a nice twist at the end with Max stopping to see her. I loved that. But oh my with Papa passing, that got me. ",77,35,2025-09-18,gaaraOftheSand182,N/A,0.85
Books that started strong but ended up losing you?,"What are those books that had such promising beginnings but managed to completely lose you by the end? Squandered potential, bad characters, poor writing, whatever the reason may be?  
Mine would probably be *Under The Dome*\- 1000 pages of build-up and tone-setting, only for the ending to devolve into a strange mad-lib. I still finished it, but I didn't finish it all that happy.   
What are all of your examples?",499,1300,2025-09-17,Weekly_Noodle,N/A,0.95
(Un)Reasonably angry at The Secret of Secrets by Dan Brown,"To preface this, a long time ago I was devouring every book of Dan Brown, and I thought I was a fan. This is why I immediately got ""The Secret of Secrets"" as soon as it got out. I thought it would be a book I wouldn't put down, and so many days later I am still struggling through it. Spoiler starting now, up to Chapter 12 of the book.

What I am angry about is the constant exposition of knowledge that we just won't get, even though the current Point of View has that information. 

Things like (big for emphasis)

>! ""the rabbi inscribed THE hebrew word""  which word? Two paragraphs later: ahhh finally !<

>! ""SHE could never know"" WHO? !<

>! ""Solomon had done something unexpected"" WHAT? !<

At least in my memory, The Davinci Code was intriguing without such techniques, but maybe my memory is faulty. Other books I read, for example ""The Tainted Cup"" were catchy without withholding information on purpose.

Was it that bad in the other books? I honestly cannot remember. Does it get better? Did you have the same feeling when reading the book?",95,99,2025-09-18,MichaelStaniek,N/A,0.76
What book do you wish you could experience for the first time all over again?,"For me, there are two: *The Hike* by Drew Magary. The last page alone makes it worthwhile, and really that is the feeling I would want over and over, but it was still gripping throughout. 

The other is *Beat the Reaper* by Josh Bazell. As heartbreaking as it is, I still remember laughing, my stomach dropping, throwing my hands up in frustration. And to this day I use the method of finding what you misplaced by thinking of where to hide it again if you needed to.",265,491,2025-09-17,M00nMantis,N/A,0.96
Texas A&M student discovers hundreds of discarded LGBTQ books in warehouse,N/A,8462,215,2025-09-16,zsreport,N/A,0.95
Inside Beirut’s Fight To Save Its Reading Culture,"(found via [LongReads](https://longreads.com/2025/09/16/beirut-literary-scene-culture/?mc_cid=e7b473c259&mc_eid=de6c895547)).

As reading declines and self-censorship grows, bookshops are shuttering in the city once hailed as the Arab world’s publishing capital.

Bookstores and literary institutions that once flourished in Beirut have shuttered over the past few years. For *New Lines Magazine,* Amelia Dhuga reports on this wider trend in the city’s creative scene. “In the last six years alone,” an editorial director at a publishing house tells Dhuga, “Lebanon has faced a revolution, a financial crisis, the port blast, COVID-19, political instability and a war.” Businesses have been forced to shut down, facing immense financial pressure. Books and authors are being censored. People are exhausted, preoccupied, or simply don’t have the disposable income to invest in literature. Despite all of this, Beirut’s remaining literary spaces are trying to stay afloat and learning to adapt.",83,5,2025-09-17,Own-Animator-7526,N/A,0.96
Literature of Saint Kitts and Nevis: September 2025,"Welcome readers,

September 16 was Heroes' Day and September 19 is Independence Day in Saint Kitts and Nevis and to celebrate we're discussing Kittitian literature! Please use this thread to discuss your favorite Kittitian books and authors.

If you'd like to read our previous discussions of the literature of the world please visit the [literature of the world](https://www.reddit.com/r/books/wiki/literatureof) section of our [wiki](https://www.reddit.com/r/books/wiki/index).

Thank you and enjoy!",19,2,2025-09-17,AutoModerator,Literature of the World,1.0
