title,text,score,num_comments,created_date,author,flair,upvote_ratio
Do you read multiple books from the same author closely together?,"It's not a totally intentional aversion, but I feel no urge to read from the same author back-to-back, even if I love their writing. I go ""Hey! They're great!"" make note of them, and move onto someone else. 

I'm drawn far more often to standalones, and when I do read series, I tend to read the entries pretty far apart. Like months or years, if I finish them at all. Which is rarely a knock on the series' quality. There are just so many books I'd like to get to and, as a reader of average speed, it makes sense to me to use that finite time to sample as much as possible. 

That, and there's avoiding the monotony of a voice becoming *too* familiar, the magic wearing off, and inversely, the fresh joy of returning to a voice you love with the distance of time. 

When you find an author you love, do you immediately go to read more from them? 

Do you plow right through series without stopping, or do you take breaks between volumes? 

How long are those breaks, and when you return, do you reread/skim the previous book(s), rely on synopses, or wing it and hope the author threw in sufficient references? 

Or do you think about none of this at all? Also extremely valid. ",230,215,2025-09-17,Ashestoashesjc,N/A,0.95
This book arrived in mailboxes all around Baltimore with no explanation. Until now,N/A,151,24,2025-09-17,drak0bsidian,N/A,0.84
"""Phew I'm halfway"" vs ""phew I'm only halfway""","I can't imagine i'm the only one who glances at my bookmark thinking one or the other. As I currently read *The Stand* by Stephen King I'm feeling the latter, fully engrossed in the unabridged story and relieved that I have another 575 pages to look forward to. 

In comparison to my memory of reading Mary Shelly's *The Last Man* which (minor plot spoilers) shares a similar plot premise of an apocalyptic disease killing most of humanity. I greatly enjoyed her story and feel no regret in reading it, I plan to read it again, it was just difficult for me to ""get through"" the book. The writing is extremely descriptive and how I can only describe as eloquently verbose. Mary painted imagery in my mind but I was often interrupted, many times a page, to define words due to her dense sentence structure, vocabulary, and descriptions. 

I'm curious to hear of stories that were difficult for you to read through, but you ENJOYED overall, and stories that were so immersing that you lost some sleep until the last 100 pages where you procrastinated leaving such lovable characters behind. ",116,61,2025-09-17,TheBoraxKid1trblz,N/A,0.85
"Another space adventure series by E.E Doc Smith, ""The Skylark of Space"" first of the Skylark series.","Made another return to the world of E.E. Doc Smith again by reading another book from another of his space operas, the Skylark series! And now I've finished book one of that series ""The Skylark of Space""!

A scientist named Richard Seaton discovers the secret to releasing the ultimate energy, and also the key to space exploration. DuQuesne, a very powerful and unscrupulous man, has attempted to take that secret by any means necessary.

This all ends in space, where both Seaton and DuQuesne and three others wind up being marooned, many light years away from Earth. And with only one in a million chance of returning!

I just love these space opera adventures! this series, like the Lensman series, isn't all that complex or anything like that, just pure simple fun! These stories are primarily going to be focusing on journeys of the Skylark and its inventor, and even including some others too, and also his conflicts with the cold and calculating DuQuesne.

I've just started on another of the Skylark books, but unfortunately it isn't the second book of the series, ""Skylark Three"". Though I try to keep my mind focused when selecting books, especially when it comes to possible series that might come across. But there are still times I end up getting book from a series but it always end up being a second book or other, and it that can mess up the order I'm trying to get them in.",17,8,2025-09-17,i-the-muso-1968,N/A,0.91
Do you have any favorite books that you only learned about because of a member of an older generation?,"Speaking for myself, I had free access to the book collection at my grandparents house when I was young. I tried most of them and liked  C S Forester's Hornblower series about the british navy. I liked the series because it was a compelling set of adventures, but also because it explored the main character's flaws and self doubts, his struggle with necessary mathematical tools for navigation, his social anxiety.  Knowing that I had enjoyed those, led me as an adult to try Patrick O'Brian's excellent and more sophisticated series that starts with Master and Commander. 


More formally, an English professor introduced me to Slaughterhouse Five and the Death of Ivan Illych, both of which I still admire and appreciate. Death of Ivan Illych might be my candidate for best book I've ever read, although I've since then read a few other contenders, notably Remains of the Day.  

Death of Ivan Illych succinctly describes a man's transition from social success to dying invalid and the social cost of that transition for him. It shows the shallowness of his friends and family and how quickly they shift their attention from him to other concerns while he faces death alone. I still believe that people can be better to each other when tragedy strikes, but this book shows that they won't necessarily, in just a few pages. It was a book that changed my impression of what a book could do for a reader. It stretched my concept of what a narrative could show and be. 


Do you have stories about older people who have influenced your reading journey, and the books they led you to read?",38,62,2025-09-17,Fancy-Restaurant4136,N/A,0.81
I couldn't finish the dune series.,I have been reading the dune series for awhile now. I reached the fourth book but I just can't seem to finish it. I already took forever to finish the first three books but this fourth one is a really slow read. The slow pacing is killing me. I've read over half of the book and I feel like nothing actually happened in the past 320 pages.  I don't feel any connection to the characters expect for Duncan and Sonia. I feel like the first book was the last book I actually enjoyed reading in the series and even that is a stretch. The books tend to have the slowest pacing ever and I feel like the characters are more like political pawns than actually being a character I can connect to. I think I am going to take a break from the series and move on to other books. Such a shame since I've seen many people say the fourth book is one of the best in the series but I can't seem to finish or enjoy it :(,246,389,2025-09-16,Celesticalking,N/A,0.8
Do you admire an author for more than just their books?,"For me, it’s Margaret Atwood. Her writing is poetic, but what truly inspires me is who she is as a person. Her wit, humor, irony, and unapologetic feminism is so inspiring. Her MasterClass on writing motivated me to start writing every day, Have you ever started reading an author’s work because you admired them as a person first?",442,371,2025-09-16,dictiondaddy,N/A,0.88
"Banned Books Discussion: September, 2025","Welcome readers,

Over the last several weeks/months we've all seen an uptick in articles about schools/towns/states banning books from classrooms and libraries. Obviously, this is an important subject that many of us feel passionate about but unfortunately it has a tendency to come in waves and drown out any other discussion. We obviously don't want to ban this discussion but we also want to allow other posts some air to breathe. In order to accomplish this, we're going to post a discussion thread every month to allow users to post articles and discuss them. In addition, our friends at /r/bannedbooks would love for you to check out their sub and discuss banned books there as well.",31,26,2025-09-16,AutoModerator,N/A,0.7
Thank-you Robert Munsch,"Early today I read about your decision. I've been overwhelmed with so many emotions about it, and I've felt compelled to tell you, or the world, or whoever would listen - how much you mean to me. I've been saddened, but I also feel a certain level of gratitude that you're going to allow us all to say good bye to you. And in this moment, I want to say good bye, in this way, and I invite other to as well. I hope somehow this gets to you. 

I'm typing this on my phone while I sit on the foot of my oldest sons bed. I just finished reading him Moose! I've read it so many times you'd think I'd have it memorized, but I tripped up a few times - he noticed. 

My favorite book to read to my boys has always been Hugs - I get to squeeze them, and tickle them, and slobber all over them. 

My middle loves to read about Mortimer. He loves going to bed first, because we can sing at the top of our lungs. 

Sometimes I think you wrote Thomas' snowsuit about my youngest, but thats not his favorite. His favorite i Mmm Cookies! Because we get to shmack and gwackk them all over his little legs. 

I remember my dad reading your books to my brother and my sister. Our favorite was Purple, Green, and Yellow. We still call some markers the never come off until you're dead and maybe even later markers. It was also the first of your books I bought when my boys were born. 

The second was the paperbag princess, I remember my sister dressing up in a leaf bag as a kid. But what I didn't realize was how empowering that story was until I read it years later - you enabled a generation of princesses to tell the ""not so charming"" they stink. 

You brought so much joy into my bedtimes, and you continue to bring so much joy to bedtime for my sons. I'm sure they'll read you to their kids, and I know there will be little cardboard libraries from you all over this beautiful country. 

Thank-you Mr. Munsch. I'll love you forever, I'll like you for always. ",314,28,2025-09-16,thesweeterpeter,N/A,0.93
Struggling to understand a phrase in “The Faerie Queene”,"I am struggling to parse lines 7–8 of stanza 37 of Canto 9 or Book 2 of *The Faerie Queene*. Context here is that Arthur (still a prince, not king yet) is encountering a room full of beautiful maidens. Some represent what the annotators of my editions call the “forward or concupiscible passions,” some the “froward or irascible” ones. Arthur’s eye is caught by one of the latter, who is “right faire and fresh as morning rose, / But somwhat sad, and solemne eke in sight, / As if some pensiue thought constraind her gentle spright.” Then (bolding the part that is giving me trouble):

>In a long purple pall, whose skirt with gold,  
Was fretted all about, she was arayd;  
And in her hand a Poplar branch did hold:  
To whom the prince in courteous maner sayd,  
Gentle Madame, why beene ye thus dismayd,  
And your faire beautie doe with sadnes spill?  
Liues any, that you hath thus ill apayd?  
Or doen you loue, or **doen you lack your will?**  
What euer bee the cause, it sure beseemed you ill.

The annotator explains “ill apayd” as “requited,” and it seems to me like the subject of “hath thus ill apayd” is “any,” with the object being “you.” That is, it seems to me that line 7 means: “Is there anyone living who has thus failed to requite your love for him?” But it is not clear to me if the subject of “doen” in line 8 is still that “any,” or if it is now “you.” And, in either case, it’s not clear to me what line 8 means. If the subject is still “any,” the couplet would seem to be something like: “Is there anyone living who has thus failed to requite your love for him? / Or who has made advances toward \[or had sex with?\] you or”—but here I am unsure what “doen you lack your will” means. If the subject is now “you,” then the lines would seem to mean something like: “Is there anyone living who has thus failed to requite your love for him? / Or have you loved, or”—again, I don’t know what it would mean for a person to “lack her will.”

Thanks in advance. Obviously, the annotations shed no light on this matter.",13,17,2025-09-16,Charles_Sumner,N/A,0.75
SA Cosby’s My Darkest Prayer,"I’ve just finished this one after previously reading Cosby’s Blacktop Wasteland and All the Sinners Bleed, both of which I really enjoyed thanks to the great vibe Cosby lays down with his writing and his main characters, which simultaneously manage to be the coolest most badass dudes around but have actual complexity and inner turmoil that feels real behind all of that.

My Darkest Prayer is Cosby’s first book, and I could definitely tell. It’s way more crass, feeling like 70s exploitation media rather than straight up crime noir, and the characters don’t have a ton of complexity to them, but I ended up loving it in a different way to his other books.

My Darkest Prayer follows Nathan Waymaker. I’ve never read Jack Reacher books, but from what I can gather Nathan is a half-black Rwacher. He’s a brick shithouse of a man that never loses a fight, he’s never wrong, he always does the right, he’s had sex with half the women in town and the other half want to have sex with him, he’s basically a master detective despite his background as a funeral services guy in the marines and small town sheriffs deputy (that ended when he threw someone through a plate glass window) and he’s always got the coolest lines to come back at his rivals with. 

Nathan reads like the self-insert character a 12 year old dreamt up and finally got a chance to write about as an adult, and despite how negative that sounds I loved it. When I first started the book, I was noticing all these cliches it followed and mentally docking it some points, but as I kept reading I just found myself having so much fun taking in this story. 

At the end of the day, the book is closer to a Netflix series I would binge over the weekend than it is to the Godfather, but sometimes I need that and appreciate it. 
",10,5,2025-09-16,Prize_Ad_129,N/A,0.73
Australian War Memorial changes book prize rules to reject Ben Roberts-Smith exposé,N/A,772,69,2025-09-15,ARBlackshaw,N/A,0.96
"Simple Questions: September 16, 2025","Welcome readers, 
        
Have you ever wanted to ask something but you didn't feel like it deserved its own post but it isn't covered by one of our other scheduled posts?  Allow us to introduce you to our new Simple Questions thread!  Twice a week, every Tuesday and Saturday, a new Simple Questions thread will be posted for you to ask anything you'd like.  And please look for other questions in this thread that you could also answer!  A reminder that this is not the thread to ask for book recommendations.  All book recommendations should be asked in /r/suggestmeabook or our Weekly Recommendation Thread.
        
Thank you and enjoy!",3,13,2025-09-16,AutoModerator,WeeklyThread,0.71
Finished The Well of Ascension: here’s my thoughts on it,"Warning: I read this in Spanish so apologies if some terms might not be the same as in the English version. I really need to write this down before I forget. This will be long so…

This has been one of the most *acidic* plot twist I’ve ever read in my life.

At first, the book feels a bit slow. Sanderson takes his time with the details, and you get the impression it’s dragging. But one thing I really appreciate is how well he handles reminders from The Final Empire. It had been more than a year and a half since I read book one, and yet I had no problem diving back into the universe. Sure, it can feel heavy at times, but you later realize that every explanation had a purpose.

What blew me away is how Sanderson uses almost the entire book to build up a crisis (not just political, but existential) for a group of people who end up realizing that everything they thought they knew was a lie. In the last 100 pages, he dismantles a fundamental part of the world he had built so far. Suddenly, what’s written isn’t necessarily the truth, and there’s something behind it that can alter history for its own benefit. That idea is insane.

The concept that anything not recorded in steel can’t be trusted, and finally getting the true text of Kwaan’s inscription, gave the book such a massive boost. Everything clicked, and at the same time, nothing was what I thought.

Another huge highlight for me was Vin’s growth. She spends so much of the book frustrated, not fully understanding her own identity. Meeting Zane gives her a glimpse of it, only for her to lose it again by the end. At the same time, she discovers that her powers are far more significant than she ever imagined. I don’t dare say the idea of the Hero of Ages will disappear, because Vin embodies so many of its traits. My hypothesis is that she will ultimately become that Hero, whatever that truly means. I need to see that conclusion. Vin was already a solid character in book one, but her growth in book two is flawless.

The secondary characters also shined much more than in The Final Empire. We got a deeper understanding of their motivations, how they think, and ultimately how Kelsier’s plan, for all his ruthlessness and sharp edges, was rooted in his belief that people are good at heart. Every single character had meaningful growth, and even the deaths felt purposeful.

And then there’s the magic system. The metals, the discovery of duralumin, the way everything expands… it all felt perfect. Yes, this is a dense book. Yes, it drags in places. And yes, sometimes you want to stop and take a break. But short answer: it’s worth it. Every piece of information matters, and I’m certain many of these details will play a much bigger role in book three.

Expanding a bit more on the duralumin… learning that it enhances the power of all the other metals was already wild, but realizing that through duralumin Vin can actually control the kandra and the koloss? That was one of the biggest plot twists in the entire book for me. It basically places her on the same level as the Lord Ruler. It’s not explored in depth here, but I’m convinced this will be a huge foundation for book three and I can’t wait to see how Sanderson develops it.

What exactly meant Terris, the prophecies, the true nature of the Well? What exactly Vin unleashed? We already know history isn’t what we thought. There’s something out there that twisted everything for its own freedom. Is it Alendi? Is it something born out of resentment? Or something else entirely? 
",56,30,2025-09-15,HiddenTulips,N/A,0.82
"What Books did You Start or Finish Reading this Week?: September 15, 2025","Hi everyone!

What are you reading? What have you recently finished reading? What do you think of it? We want to know!

We're displaying the books found in this thread in the book strip at the top of the page. If you want the books you're reading included, use the formatting below.

**Formatting your book info**

Post your book info in this format:

**the title, by the author** 

For example:

**The Bogus Title, by Stephen King**

* This formatting is voluntary but will help us include your selections in the book strip banner.

* Entering your book data in this format will make it easy to collect the data, and the bold text will make the books titles stand out and might be a little easier to read.

* Enter as many books per post as you like but only the parent comments will be included. Replies to parent comments will be ignored for data collection.

* To help prevent errors in data collection, please double check your spelling of the title and author.

**NEW**: Would you like to ask the author you are reading (or just finished reading) a question? Type **!invite** in your comment and we will reach out to them to request they join us for a community Ask Me Anything event!

-Your Friendly /r/books Moderator Team",178,948,2025-09-15,AutoModerator,WeeklyThread,0.95
Some more thoughts on 'Project Hail Mary' (spoilers),"edit - finished the book. It was a good read. 

After all the hype, I was hoping for 'Amaze! Happy happy happy!' but it didn't quite reach that.

I still think Rocky is easily the best part of the whole book. And I would've liked to see some more about what happened on Earth and Stratt, and more on Erid. 

and since I've read the book now, I saw the movie trailer. 90% of it about Gosling whining and complaining - why does that need to be in the trailer even if is accurate? And of course they spoil everything. Don't think it will be anywhere close to The Martian.

-------------old----------

I'm almost 3/4ths done with the book, I hope its ok to post here and share some thoughts/questions, even though I haven't finished and don't want any spoilers or surprises if they are present. 

I'm up to ch 24 so rest of post will have spoilers till then.

- don't really like the protagonist. He's a very weird mix of character types with no consistency, written to be a movie character almost. he's supposed to be genius level smart, snarky, zero emotional impulse control, he's cried a hundred times so far. its like he's written to be Mark Watney + crying.

- so he has access to literally every book/manual ever written. every ship/boat/aircraft ever built has a flight manual with detailed procdures for every little thing. so why the hell is he always stumbling around trying to figure out things? he's had tons of free time? why didn't he open the 'flight manual' or 'mission briefing' and just read it?

- the book is admired for its science but there are so many inconsistencies. eg in the scene when power goes out he's in the dark asking where the doors are in storage area. yet 2 paragraphs later he's using a flashlight. why the hell wouldn't you grab one first?

- the whole sequence with the ship getting damaged on Adrian. Grace ignores multiple warnings from the computer and dismisses them, out of character. even more unbelievable is Rocky ignoring that, since he's so much smarter

- 5TB storage? in 2021? thats way too low! and laptops? why would he not give Rocky multiple ssd's copied with everything from his computer (all human knowledge, not just wikipedia) and show him the simple program to convert it to sound? such software already exists on there for blind users!

- there are so many wondrous things happening, alien worlds, life forms, planet which is source of all life, yet he barely thinks about any of these.

- Rocky is basically the hero of the book so far. you'd think Grace would spend a tiny bit of time preparing for  health emergencies once he moved in, ask about his life support etc. Instead he almost kills him after Rocky saves his life, because once again he has no clue about anything he doesn't know after his high school days. and he's ungrateful to Rocky, Grace certainly wouldn't have risked his own life like that.

- Grace is not only a selfish coward, he's an asshole, even though the writer tries to make him sympathetic. None of the 'science stuff' he does is really that impressive, he was right, anyone else would've been just as qualified. Wihout Rocky nothing happens. 

- there should be a lot more about how Eridians developed all this tech while lacking vision or science basics. he speculates on this but the answers aren't very satisfying, for a hard scifi book

- as far as writing quality, its very monotone with the same sentence structure. the only well developed character is Stratt, and the only memorable lines are from Rocky.


ok I'm back to the book, things better end well for Rocky and Erid!!",0,24,2025-09-16,ECrispy,N/A,0.5
